{
  "metadata": {
    "description": "Mapping from C language concepts to Ferrocene Language Specification (FLS) sections and IDs",
    "purpose": "Used by map_misra_to_fls.py to generate draft mappings from MISRA/CERT guidelines to FLS",
    "fls_version": "1.0 (2024)",
    "created_date": "2025-12-31",
    "last_updated": "2025-12-31",
    "applicability_model": "Dual applicability: all_rust (including unsafe) vs safe_rust (safe subset only)"
  },
  "concepts": {
    "memory_allocation": {
      "description": "Dynamic memory allocation and deallocation (malloc, free, heap)",
      "keywords": ["malloc", "free", "alloc", "realloc", "calloc", "heap", "memory allocation", "dynamic memory", "deallocation", "memory management"],
      "fls_ids": [
        "fls_ronnwodjjjsh",
        "fls_svkx6szhr472",
        "fls_3xvm61x0t251",
        "fls_4jiw35pan7vn",
        "fls_u2mzjgiwbkz0",
        "fls_rm4ncoopcdvj",
        "fls_5eima0pd31c0",
        "fls_afafmafz4hf2"
      ],
      "fls_sections": ["15", "15.1", "15.2", "15.6", "15.7", "15.8", "15.8.1", "15.9"],
      "typical_applicability_all_rust": "partial",
      "typical_applicability_safe_rust": "rust_prevents",
      "rationale": "Safe Rust prevents use-after-free and double-free at compile time via ownership; unsafe Rust can use raw allocator APIs"
    },
    "pointers": {
      "description": "Pointer types, dereferencing, null pointers, pointer arithmetic",
      "keywords": ["pointer", "dereference", "null", "NULL", "address", "indirection", "pointer to", "void pointer"],
      "fls_ids": [
        "fls_3i4ou0dq64ny",
        "fls_ppd1xwve3tr7",
        "fls_142vncdktbin",
        "fls_v5x85lt5ulva",
        "fls_a14slch83hzn",
        "fls_5cm4gkt55hjh",
        "fls_qztk0bkju9u",
        "fls_jep7p27kaqlp",
        "fls_jd1inwz7ulyw"
      ],
      "fls_sections": ["4.7", "4.7.2", "4.7.3", "15.3", "15.4", "6.5.2", "6.5.1", "19", "19.-2.4"],
      "typical_applicability_all_rust": "partial",
      "typical_applicability_safe_rust": "rust_prevents",
      "rationale": "Safe Rust uses references with borrow checking, preventing null/dangling pointers; raw pointers require unsafe blocks"
    },
    "pointer_arithmetic": {
      "description": "Pointer arithmetic, array indexing via pointers",
      "keywords": ["pointer arithmetic", "pointer operand", "subtraction between pointers", "pointer addition"],
      "fls_ids": [
        "fls_ppd1xwve3tr7",
        "fls_uj0kpjwyld60",
        "fls_vpbikb73dw4k",
        "fls_1k9mkv7rbezi",
        "fls_jep7p27kaqlp",
        "fls_jd1inwz7ulyw"
      ],
      "fls_sections": ["4.7.2", "4.4.1", "4.4.2", "6.5.5", "19", "19.-2.4"],
      "typical_applicability_all_rust": "partial",
      "typical_applicability_safe_rust": "rust_prevents",
      "rationale": "Safe Rust uses bounds-checked indexing; pointer arithmetic requires unsafe"
    },
    "arrays": {
      "description": "Array types, bounds checking, buffer access",
      "keywords": ["array", "buffer", "bounds", "index", "element", "subscript", "out of bounds"],
      "fls_ids": [
        "fls_uj0kpjwyld60",
        "fls_vpbikb73dw4k",
        "fls_xinykul167l",
        "fls_qfsfnql1t7m"
      ],
      "fls_sections": ["4.4.1", "4.4.2", "6.8.1", "6.8.2"],
      "typical_applicability_all_rust": "partial",
      "typical_applicability_safe_rust": "rust_prevents",
      "rationale": "Safe Rust performs bounds checking on array access; unsafe can use unchecked access"
    },
    "references_borrowing": {
      "description": "References, borrowing, lifetimes",
      "keywords": ["reference", "borrow", "lifetime", "aliasing", "mutable reference", "shared reference"],
      "fls_ids": [
        "fls_142vncdktbin",
        "fls_v5x85lt5ulva",
        "fls_a14slch83hzn",
        "fls_qztk0bkju9u",
        "fls_5cm4gkt55hjh"
      ],
      "fls_sections": ["4.7.3", "15.3", "15.4", "6.5.1", "6.5.2"],
      "typical_applicability_all_rust": "direct",
      "typical_applicability_safe_rust": "direct",
      "rationale": "Core Rust concept for safe memory access, applies to all Rust"
    },
    "initialization": {
      "description": "Variable initialization, uninitialized values",
      "keywords": ["initialize", "initialization", "uninitialized", "initializer", "initial value", "default value"],
      "fls_ids": [
        "fls_3xvm61x0t251",
        "fls_svkx6szhr472",
        "fls_8wnyln2nmg4y",
        "fls_jep7p27kaqlp"
      ],
      "fls_sections": ["15.2", "15.1", "6.4.4", "19"],
      "typical_applicability_all_rust": "partial",
      "typical_applicability_safe_rust": "rust_prevents",
      "rationale": "Safe Rust requires initialization before use; unsafe can use MaybeUninit"
    },
    "integer_types": {
      "description": "Integer types, signedness, overflow",
      "keywords": ["integer", "signed", "unsigned", "overflow", "wraparound", "int", "i32", "u32", "arithmetic"],
      "fls_ids": [
        "fls_3qnpv2z7yjil",
        "fls_1k9mkv7rbezi",
        "fls_abp6tjbz8tpn",
        "fls_nsvzzbldhq53",
        "fls_id66vnaqw0zt"
      ],
      "fls_sections": ["4.3.3.2", "6.5.5", "6.5.6", "6.5.7", "4.3"],
      "typical_applicability_all_rust": "partial",
      "typical_applicability_safe_rust": "partial",
      "rationale": "Rust has checked arithmetic in debug mode, wrapping/saturating methods; overflow behavior differs from C"
    },
    "floating_point": {
      "description": "Floating point types, precision, NaN, infinity",
      "keywords": ["float", "floating", "double", "f32", "f64", "NaN", "infinity", "precision"],
      "fls_ids": [
        "fls_b4xporvr64s",
        "fls_29tlg1vyqay2",
        "fls_1k9mkv7rbezi",
        "fls_nsvzzbldhq53"
      ],
      "fls_sections": ["4.3.3.1", "2.4.4.2", "6.5.5", "6.5.7"],
      "typical_applicability_all_rust": "partial",
      "typical_applicability_safe_rust": "partial",
      "rationale": "Rust has similar floating point semantics to C (IEEE 754)"
    },
    "type_conversions": {
      "description": "Type casts, implicit conversions, coercion",
      "keywords": ["cast", "type conversion", "coercion", "implicit conversion", "explicit conversion", "type cast"],
      "fls_ids": [
        "fls_1qhsun1vyarz",
        "fls_dw33yt5g6m0k",
        "fls_exe4zodlwfez",
        "fls_lv7w7aalpwm5"
      ],
      "fls_sections": ["6.5.10", "4.12.3", "4.12.2", "4.12.7"],
      "typical_applicability_all_rust": "partial",
      "typical_applicability_safe_rust": "partial",
      "rationale": "Rust requires explicit casts; no implicit narrowing conversions; transmute is unsafe"
    },
    "structs": {
      "description": "Struct types, members, layout",
      "keywords": ["struct", "structure", "member", "field", "record"],
      "fls_ids": [
        "fls_9ucqbbd0s2yo",
        "fls_rjxpof29a3nl",
        "fls_7pby13muw48o",
        "fls_g1z6bpyjqxkz"
      ],
      "fls_sections": ["4.5.2", "4.11.2.2", "4.11", "4.11.1"],
      "typical_applicability_all_rust": "direct",
      "typical_applicability_safe_rust": "direct",
      "rationale": "Rust has similar struct semantics"
    },
    "unions": {
      "description": "Union types, overlapping storage",
      "keywords": ["union type", "union field", "overlapping storage"],
      "fls_ids": [
        "fls_fmdn7n7s413d",
        "fls_cmq8ogs84ivh",
        "fls_jep7p27kaqlp",
        "fls_ucghxcnpaq2t"
      ],
      "fls_sections": ["4.5.3", "4.11.2.3", "19", "19.-2.7"],
      "typical_applicability_all_rust": "partial",
      "typical_applicability_safe_rust": "not_applicable",
      "rationale": "Rust unions require unsafe to read; safe Rust should use enums for tagged unions"
    },
    "enums": {
      "description": "Enumeration types, enumerators",
      "keywords": ["enum", "enumeration", "enumerator", "variant"],
      "fls_ids": [
        "fls_szibmtfv117b",
        "fls_xc1hof4qbf6p",
        "fls_7pby13muw48o"
      ],
      "fls_sections": ["4.5.1", "4.11.2.1", "4.11"],
      "typical_applicability_all_rust": "direct",
      "typical_applicability_safe_rust": "direct",
      "rationale": "Rust enums are more powerful (algebraic data types)"
    },
    "bit_fields": {
      "description": "Bit-fields, bit manipulation",
      "keywords": ["bit-field", "bitfield", "bit field", "bits"],
      "fls_ids": [
        "fls_abp6tjbz8tpn",
        "fls_7pby13muw48o",
        "fls_ohhsmifo0urd"
      ],
      "fls_sections": ["6.5.6", "4.11", "4.11.2"],
      "typical_applicability_all_rust": "not_applicable",
      "typical_applicability_safe_rust": "not_applicable",
      "rationale": "Rust has no native bit-field syntax; use bitflags crate or manual bit manipulation"
    },
    "functions": {
      "description": "Function declarations, parameters, return values",
      "keywords": ["function", "parameter", "argument", "return", "call", "declaration", "prototype"],
      "fls_ids": [
        "fls_hbbek3z4wtcs",
        "fls_xztr1kebz8bo",
        "fls_airvr79xkcag",
        "fls_77scxuomlbgs",
        "fls_lnpyb285qdiy"
      ],
      "fls_sections": ["4.6", "4.6.1", "4.6.2", "15.5", "14.4.7"],
      "typical_applicability_all_rust": "direct",
      "typical_applicability_safe_rust": "direct",
      "rationale": "Similar function semantics with stronger type checking"
    },
    "function_pointers": {
      "description": "Function pointers, callbacks",
      "keywords": ["function pointer", "callback", "fn pointer"],
      "fls_ids": [
        "fls_xztr1kebz8bo",
        "fls_3i4ou0dq64ny"
      ],
      "fls_sections": ["4.7.1", "4.7"],
      "typical_applicability_all_rust": "direct",
      "typical_applicability_safe_rust": "direct",
      "rationale": "Rust has fn pointer types and closures"
    },
    "recursion": {
      "description": "Recursive functions, self-referential",
      "keywords": ["recursive", "recursion", "call themselves", "self-referential"],
      "fls_ids": [
        "fls_3gapgqys3ceb",
        "fls_hbbek3z4wtcs"
      ],